{
  "version": 2,
  "artifact_relpath": "artifact.bin",
  "artifact_type": "external_model",
  "smoke_argv": ["python", "{repo}/smoke.py"],
  "eval_argv": ["python", "{repo}/eval.py", "{artifact}"],
  "dependency_mode": "pinned_image_only",
  "dependency_locks": [],
  "factory_protocol": {
    "name": "repository factory",
    "version": 1,
    "scope_spec": {"dataset": "frozen"},
    "metrics": [{
      "log_key": "accuracy",
      "name": "accuracy",
      "version": 1,
      "direction": "higher",
      "unit": "ratio",
      "compute_spec": "adapter aggregate",
      "readout_rule": "higher is better"
    }],
    "required": ["accuracy"]
  }
}
